[
  {"id":"cc-build","schema_version":1,"group":"post-integration-green","owner":"release-engineering","requirement_ids":["HA-P0-007"],"repository":"cc-gateway","cwd":"${CC_GATEWAY_ROOT}","argv":["npm","run","build"],"env":{"CI":"1","POST_INTEGRATION_MANIFEST":"${POST_INTEGRATION_MANIFEST}"},"inherit_env":["PATH","HOME","TMPDIR"],"manifest_binding":{"manifest_path":"${POST_INTEGRATION_MANIFEST}","repository_head_field":"repositories.cc_gateway.head"},"allowed_worktree_delta":[],"timeout_ms":300000,"expected_exit":0,"output_policy":"digest_only","rollback":"rerun from the bound clean integrated main"},
  {"id":"cc-test","schema_version":1,"group":"post-integration-green","owner":"release-engineering","requirement_ids":["HA-P0-001","HA-P0-002","HA-P0-007"],"repository":"cc-gateway","cwd":"${CC_GATEWAY_ROOT}","argv":["npm","test"],"env":{"CI":"1","POST_INTEGRATION_MANIFEST":"${POST_INTEGRATION_MANIFEST}"},"inherit_env":["PATH","HOME","TMPDIR"],"manifest_binding":{"manifest_path":"${POST_INTEGRATION_MANIFEST}","repository_head_field":"repositories.cc_gateway.head"},"allowed_worktree_delta":[],"timeout_ms":600000,"expected_exit":0,"output_policy":"digest_only","rollback":"rerun from the bound clean integrated main"},
  {"id":"sidecar-test","schema_version":1,"group":"post-integration-green","owner":"sidecar-owner","requirement_ids":["AV-B5-001","AV-B6-001"],"repository":"egress-tls-sidecar","cwd":"${CC_GATEWAY_ROOT}/sidecar/egress-tls-sidecar","argv":["go","test","./...","-count=1"],"env":{"CI":"1","POST_INTEGRATION_MANIFEST":"${POST_INTEGRATION_MANIFEST}"},"inherit_env":["PATH","HOME","TMPDIR"],"manifest_binding":{"manifest_path":"${POST_INTEGRATION_MANIFEST}","repository_head_field":"repositories.cc_gateway.head"},"allowed_worktree_delta":[],"timeout_ms":600000,"expected_exit":0,"output_policy":"digest_only","rollback":"rerun from the bound clean integrated main"},
  {"id":"sub2api-test","schema_version":1,"group":"post-integration-green","owner":"sub2api-formal-pool-owner","requirement_ids":["HA-P0-006"],"repository":"sub2api","cwd":"${SUB2API_ROOT}/backend","argv":["go","test","./internal/service","./internal/server/routes","-run","FormalPool|FormalPoolOperations","-count=1"],"env":{"CI":"1","POST_INTEGRATION_MANIFEST":"${POST_INTEGRATION_MANIFEST}"},"inherit_env":["PATH","HOME","TMPDIR"],"manifest_binding":{"manifest_path":"${POST_INTEGRATION_MANIFEST}","repository_head_field":"repositories.sub2api.head","contract_digest_field":"contract.sha256"},"allowed_worktree_delta":[],"timeout_ms":600000,"expected_exit":0,"output_policy":"digest_only","rollback":"rerun from the bound clean integrated main"},
  {"id":"cc-b4-b6-red","schema_version":1,"group":"post-integration-red","owner":"cc-gateway-oracle-owner","requirement_ids":["AV-B4-001","AV-B6-001","HA-P0-009"],"repository":"cc-gateway","cwd":"${CC_GATEWAY_ROOT}","argv":["npm","exec","tsx","tests/red/phase0-boundary.red.test.ts"],"env":{"CI":"1","POST_INTEGRATION_MANIFEST":"${POST_INTEGRATION_MANIFEST}"},"inherit_env":["PATH","HOME","TMPDIR"],"manifest_binding":{"manifest_path":"${POST_INTEGRATION_MANIFEST}","repository_head_field":"repositories.cc_gateway.head"},"allowed_worktree_delta":[],"timeout_ms":300000,"expected_exit":"nonzero","output_policy":"redacted_excerpt","rollback":"retain only stable failure names and the expected RED classification"},
  {"id":"sidecar-b4-b6-red","schema_version":1,"group":"post-integration-red","owner":"sidecar-owner","requirement_ids":["AV-B4-001","AV-B5-001","AV-B6-001"],"repository":"egress-tls-sidecar","cwd":"${CC_GATEWAY_ROOT}/sidecar/egress-tls-sidecar","argv":["go","test","-tags=phase0red","./internal/control","./internal/server","-count=1"],"env":{"CI":"1","POST_INTEGRATION_MANIFEST":"${POST_INTEGRATION_MANIFEST}"},"inherit_env":["PATH","HOME","TMPDIR"],"manifest_binding":{"manifest_path":"${POST_INTEGRATION_MANIFEST}","repository_head_field":"repositories.cc_gateway.head"},"allowed_worktree_delta":[],"timeout_ms":300000,"expected_exit":"nonzero","output_policy":"redacted_excerpt","rollback":"retain only stable failure names and the expected RED classification"},
  {"id":"sub2api-b1-b3-red","schema_version":1,"group":"post-integration-red","owner":"sub2api-formal-pool-owner","requirement_ids":["AV-B1-001","AV-B2-001","AV-B3-001"],"repository":"sub2api","cwd":"${SUB2API_ROOT}/backend","argv":["go","test","-tags=phase0red","./internal/service","./internal/server/routes","-run","FormalPoolOnboarding|FormalPoolOperations|Browser|Egress","-count=1"],"env":{"CI":"1","POST_INTEGRATION_MANIFEST":"${POST_INTEGRATION_MANIFEST}"},"inherit_env":["PATH","HOME","TMPDIR"],"manifest_binding":{"manifest_path":"${POST_INTEGRATION_MANIFEST}","repository_head_field":"repositories.sub2api.head","contract_digest_field":"contract.sha256"},"allowed_worktree_delta":[],"timeout_ms":300000,"expected_exit":"nonzero","output_policy":"redacted_excerpt","rollback":"retain only stable failure names and the expected RED classification"}
]
